Unnamed: 0,action_type,activity_comment,activity_id,activity_properties,assay_chembl_id,assay_description,assay_type,assay_variant_accession,assay_variant_mutation,bao_endpoint,bao_format,bao_label,canonical_smiles,data_validity_comment,data_validity_description,document_chembl_id,document_journal,document_year,ligand_efficiency,molecule_chembl_id,molecule_pref_name,parent_molecule_chembl_id,pchembl_value,potential_duplicate,qudt_units,record_id,relation,src_id,standard_flag,standard_relation,standard_text_value,standard_type,standard_units,standard_upper_value,standard_value,target_chembl_id,target_organism,target_pref_name,target_tax_id,text_value,toid,type,units,uo_units,upper_value,value
16542,,,22975780,"[{'comments': None, 'relation': '=', 'result_flag': 0, 'standard_relation': '=', 'standard_text_value': None, 'standard_type': 'TIME', 'standard_units': 'hr', 'standard_value': '24.0', 'text_value': None, 'type': 'Time', 'units': 'hrs', 'value': '24.0'}]",CHEMBL4771722,Antimicrobial activity against fluoroquinolone-resistant Escherichia coli assessed as inhibition of microbial growth incubated for 24 hrs by microbroth dilution method,F,,,BAO_0002146,BAO_0000218,organism-based format,CCn1cc(C(=O)O)c(=O)c2cc(F)c(N3CCNCC3)cc21,,,CHEMBL4765367,Eur J Med Chem,2020.0,,CHEMBL9,NORFLOXACIN,CHEMBL9,,0,http://www.openphacts.org/units/Nanomolar,3567995,=,1,1,=,,MIC,nM,,293700.0,CHEMBL354,Escherichia coli,Escherichia coli,562.0,,,MIC,mM,UO_0000065,,0.2937
16543,,,22975788,"[{'comments': None, 'relation': '=', 'result_flag': 0, 'standard_relation': '=', 'standard_text_value': None, 'standard_type': 'TIME', 'standard_units': 'hr', 'standard_value': '24.0', 'text_value': None, 'type': 'Time', 'units': 'hrs', 'value': '24.0'}]",CHEMBL4771723,Antimicrobial activity against Salmonella enterica ATCC 13312 assessed as inhibition of microbial growth incubated for 24 hrs by microbroth dilution method,F,,,BAO_0002146,BAO_0000218,organism-based format,CCn1cc(C(=O)O)c(=O)c2cc(F)c(N3CCNCC3)cc21,,,CHEMBL4765367,Eur J Med Chem,2020.0,,CHEMBL9,NORFLOXACIN,CHEMBL9,,0,http://www.openphacts.org/units/Nanomolar,3567995,<,1,1,<,,MIC,nM,,5900.0,CHEMBL613762,Salmonella enterica,Salmonella enterica,28901.0,,,MIC,mM,UO_0000065,,0.0059
16544,,,22975797,"[{'comments': None, 'relation': '=', 'result_flag': 0, 'standard_relation': '=', 'standard_text_value': None, 'standard_type': 'TIME', 'standard_units': 'hr', 'standard_value': '24.0', 'text_value': None, 'type': 'Time', 'units': 'hrs', 'value': '24.0'}]",CHEMBL4771724,Antimicrobial activity against Pseudomonas aeruginosa ATCC 9627 assessed as inhibition of microbial growth incubated for 24 hrs by microbroth dilution method,F,,,BAO_0002146,BAO_0000218,organism-based format,CCn1cc(C(=O)O)c(=O)c2cc(F)c(N3CCNCC3)cc21,,,CHEMBL4765367,Eur J Med Chem,2020.0,,CHEMBL9,NORFLOXACIN,CHEMBL9,,0,http://www.openphacts.org/units/Nanomolar,3567995,=,1,1,=,,MIC,nM,,98000.0,CHEMBL348,Pseudomonas aeruginosa,Pseudomonas aeruginosa,287.0,,,MIC,mM,UO_0000065,,0.098
16545,,,22975805,"[{'comments': None, 'relation': '=', 'result_flag': 0, 'standard_relation': '=', 'standard_text_value': None, 'standard_type': 'TIME', 'standard_units': 'hr', 'standard_value': '24.0', 'text_value': None, 'type': 'Time', 'units': 'hrs', 'value': '24.0'}]",CHEMBL4771725,Antimicrobial activity against methicillin-resistant Staphylococcus aureus ATCC 33591 assessed as inhibition of microbial growth incubated for 24 hrs by microbroth dilution method,F,,,BAO_0002146,BAO_0000218,organism-based format,CCn1cc(C(=O)O)c(=O)c2cc(F)c(N3CCNCC3)cc21,,,CHEMBL4765367,Eur J Med Chem,2020.0,,CHEMBL9,NORFLOXACIN,CHEMBL9,,0,http://www.openphacts.org/units/Nanomolar,3567995,=,1,1,=,,MIC,nM,,24400.0,CHEMBL352,Staphylococcus aureus,Staphylococcus aureus,1280.0,,,MIC,mM,UO_0000065,,0.0244
16546,,,22975814,"[{'comments': None, 'relation': '=', 'result_flag': 0, 'standard_relation': '=', 'standard_text_value': None, 'standard_type': 'TIME', 'standard_units': 'hr', 'standard_value': '24.0', 'text_value': None, 'type': 'Time', 'units': 'hrs', 'value': '24.0'}]",CHEMBL4771726,Antimicrobial activity against methicillin-sensitive Staphylococcus aureus ATCC 9253 assessed as inhibition of microbial growth incubated for 24 hrs by microbroth dilution method,F,,,BAO_0002146,BAO_0000218,organism-based format,CCn1cc(C(=O)O)c(=O)c2cc(F)c(N3CCNCC3)cc21,,,CHEMBL4765367,Eur J Med Chem,2020.0,,CHEMBL9,NORFLOXACIN,CHEMBL9,,0,http://www.openphacts.org/units/Nanomolar,3567995,=,1,1,=,,MIC,nM,,24400.0,CHEMBL352,Staphylococcus aureus,Staphylococcus aureus,1280.0,,,MIC,mM,UO_0000065,,0.0244
16547,,,22975823,"[{'comments': None, 'relation': '=', 'result_flag': 0, 'standard_relation': '=', 'standard_text_value': None, 'standard_type': 'TIME', 'standard_units': 'hr', 'standard_value': '24.0', 'text_value': None, 'type': 'Time', 'units': 'hrs', 'value': '24.0'}]",CHEMBL4771727,Antimicrobial activity against Listeria monocytogenes ATCC 19115 assessed as inhibition of microbial growth incubated for 24 hrs by microbroth dilution method,F,,,BAO_0002146,BAO_0000218,organism-based format,CCn1cc(C(=O)O)c(=O)c2cc(F)c(N3CCNCC3)cc21,,,CHEMBL4765367,Eur J Med Chem,2020.0,,CHEMBL9,NORFLOXACIN,CHEMBL9,,0,http://www.openphacts.org/units/Nanomolar,3567995,<,1,1,<,,MIC,nM,,5900.0,CHEMBL614974,Listeria monocytogenes,Listeria monocytogenes,1639.0,,,MIC,mM,UO_0000065,,0.0059
16548,,,22975832,"[{'comments': None, 'relation': '=', 'result_flag': 0, 'standard_relation': '=', 'standard_text_value': None, 'standard_type': 'TIME', 'standard_units': 'hr', 'standard_value': '48.0', 'text_value': None, 'type': 'Time', 'units': 'hrs', 'value': '48.0'}]",CHEMBL4771728,Antifungal activity against Candida albicans ATCC 10231 assessed as reduction in fungal growth incubated for 48 hrs by broth microdilution method,F,,,BAO_0002146,BAO_0000218,organism-based format,CCn1cc(C(=O)O)c(=O)c2cc(F)c(N3CCNCC3)cc21,,,CHEMBL4765367,Eur J Med Chem,2020.0,,CHEMBL9,NORFLOXACIN,CHEMBL9,,0,http://www.openphacts.org/units/Nanomolar,3567995,<,1,1,<,,MIC,nM,,5900.0,CHEMBL366,Candida albicans,Candida albicans,5476.0,,,MIC,mM,UO_0000065,,0.0059
16549,,,22975843,"[{'comments': None, 'relation': '=', 'result_flag': 0, 'standard_relation': '=', 'standard_text_value': None, 'standard_type': 'TIME', 'standard_units': 'hr', 'standard_value': '48.0', 'text_value': None, 'type': 'Time', 'units': 'hrs', 'value': '48.0'}]",CHEMBL4771729,Antifungal activity against Aspergillus flavus ATCC 9643 assessed as reduction in fungal growth incubated for 48 hrs by broth microdilution method,F,,,BAO_0002146,BAO_0000218,organism-based format,CCn1cc(C(=O)O)c(=O)c2cc(F)c(N3CCNCC3)cc21,,,CHEMBL4765367,Eur J Med Chem,2020.0,,CHEMBL9,NORFLOXACIN,CHEMBL9,,0,http://www.openphacts.org/units/Nanomolar,3567995,=,1,1,=,,MIC,nM,,782900.0,CHEMBL614955,Aspergillus flavus,Aspergillus flavus,5059.0,,,MIC,mM,UO_0000065,,0.7829
16550,,,22975854,"[{'comments': None, 'relation': '=', 'result_flag': 0, 'standard_relation': '=', 'standard_text_value': None, 'standard_type': 'TIME', 'standard_units': 'hr', 'standard_value': '48.0', 'text_value': None, 'type': 'Time', 'units': 'hrs', 'value': '48.0'}]",CHEMBL4771730,Antifungal activity against Fusarium solani ATCC 36031 assessed as reduction in fungal growth incubated for 48 hrs by broth microdilution method,F,,,BAO_0002146,BAO_0000218,organism-based format,CCn1cc(C(=O)O)c(=O)c2cc(F)c(N3CCNCC3)cc21,,,CHEMBL4765367,Eur J Med Chem,2020.0,,CHEMBL9,NORFLOXACIN,CHEMBL9,,0,http://www.openphacts.org/units/Nanomolar,3567995,=,1,1,=,,MIC,nM,,391400.0,CHEMBL612506,Fusarium solani,Fusarium solani,169388.0,,,MIC,mM,UO_0000065,,0.3914
16551,,,22975864,"[{'comments': None, 'relation': '=', 'result_flag': 0, 'standard_relation': '=', 'standard_text_value': None, 'standard_type': 'TIME', 'standard_units': 'hr', 'standard_value': '48.0', 'text_value': None, 'type': 'Time', 'units': 'hrs', 'value': '48.0'}]",CHEMBL4771731,Antifungal activity against Stachybotrys chartarum IBT 7711 assessed as reduction in fungal growth incubated for 48 hrs by broth microdilution method,F,,,BAO_0002146,BAO_0000218,organism-based format,CCn1cc(C(=O)O)c(=O)c2cc(F)c(N3CCNCC3)cc21,,,CHEMBL4765367,Eur J Med Chem,2020.0,,CHEMBL9,NORFLOXACIN,CHEMBL9,,0,http://www.openphacts.org/units/Nanomolar,3567995,=,1,1,=,,MIC,nM,,195700.0,CHEMBL613284,Stachybotrys chartarum,Stachybotrys chartarum,74722.0,,,MIC,mM,UO_0000065,,0.1957
16552,,,22975874,"[{'comments': None, 'relation': '=', 'result_flag': 0, 'standard_relation': '=', 'standard_text_value': None, 'standard_type': 'TIME', 'standard_units': 'hr', 'standard_value': '48.0', 'text_value': None, 'type': 'Time', 'units': 'hrs', 'value': '48.0'}]",CHEMBL4771732,Antifungal activity against Penicillium chrysogenum ATCC 10106 assessed as reduction in fungal growth incubated for 48 hrs by broth microdilution method,F,,,BAO_0002146,BAO_0000218,organism-based format,CCn1cc(C(=O)O)c(=O)c2cc(F)c(N3CCNCC3)cc21,,,CHEMBL4765367,Eur J Med Chem,2020.0,,CHEMBL9,NORFLOXACIN,CHEMBL9,,0,http://www.openphacts.org/units/Nanomolar,3567995,=,1,1,=,,MIC,nM,,195700.0,CHEMBL612847,Penicillium chrysogenum,Penicillium chrysogenum,5076.0,,,MIC,mM,UO_0000065,,0.1957
16553,,,22975884,"[{'comments': None, 'relation': '=', 'result_flag': 0, 'standard_relation': '=', 'standard_text_value': None, 'standard_type': 'TIME', 'standard_units': 'hr', 'standard_value': '24.0', 'text_value': None, 'type': 'Time', 'units': 'hrs', 'value': '24.0'}]",CHEMBL4771733,Cytotoxicity against rat L6 cells assessed as inhibition of cell viability incubated for 24 hrs by MTT assay,A,,,BAO_0000190,BAO_0000219,cell-based format,CCn1cc(C(=O)O)c(=O)c2cc(F)c(N3CCNCC3)cc21,,,CHEMBL4765367,Eur J Med Chem,2020.0,,CHEMBL9,NORFLOXACIN,CHEMBL9,5.46,0,http://www.openphacts.org/units/Nanomolar,3567995,=,1,1,=,,IC50,nM,,3431.1,CHEMBL614793,Rattus norvegicus,L6,10116.0,,,IC50,uM,UO_0000065,,3.4311
16554,,,22978407,"[{'comments': None, 'relation': '=', 'result_flag': 0, 'standard_relation': '=', 'standard_text_value': None, 'standard_type': 'Dose', 'standard_units': 'microM', 'standard_value': '200.0', 'text_value': None, 'type': 'Dose', 'units': 'microM', 'value': '200.0'}, {'comments': None, 'relation': '=', 'result_flag': 0, 'standard_relation': '=', 'standard_text_value': None, 'standard_type': 'TIME', 'standard_units': 'hr', 'standard_value': '5.0', 'text_value': None, 'type': 'Time', 'units': 'hrs', 'value': '5.0'}]",CHEMBL4772302,Effective permeability of the compound at 200 uM incubated for 5 hrs by PAMPA based UPLC/MS analysis,A,,,BAO_0000179,BAO_0000019,assay format,CCn1cc(C(=O)O)c(=O)c2cc(F)c(N3CCNCC3)cc21,,,CHEMBL4765382,Eur J Med Chem,2020.0,,CHEMBL9,NORFLOXACIN,CHEMBL9,,0,,3568450,=,1,0,=,,Peff,10^-6 cm/s,,0.6,CHEMBL612558,,ADMET,,,,Peff,10^-6 cm/s,,,0.6
16555,,,23129749,[],CHEMBL4808149,Enzymatic assay of human HDAC6 with commercial peptide substrate,B,,,BAO_0000201,BAO_0000357,single protein format,CCn1cc(C(=O)O)c(=O)c2cc(F)c(N3CCNCC3)cc21,Outside typical range,"Values for this activity type are unusually large/small, so may not be accurate",CHEMBL4808148,,2021.0,,CHEMBL9,NORFLOXACIN,CHEMBL9,,0,http://qudt.org/vocab/unit#Percent,3592738,=,59,1,=,,Inhibition,%,,-43.91,CHEMBL1865,Homo sapiens,Histone deacetylase 6,9606.0,,,inhibition,%,UO_0000187,,-43.91
16556,,,23138380,[],CHEMBL4808150,Enzymatic assay of human HDAC6 with custom peptide substrate,B,,,BAO_0000201,BAO_0000357,single protein format,CCn1cc(C(=O)O)c(=O)c2cc(F)c(N3CCNCC3)cc21,,,CHEMBL4808148,,2021.0,,CHEMBL9,NORFLOXACIN,CHEMBL9,,0,http://qudt.org/vocab/unit#Percent,3592738,=,59,1,=,,Inhibition,%,,0.59,CHEMBL1865,Homo sapiens,Histone deacetylase 6,9606.0,,,inhibition,%,UO_0000187,,0.59
16557,,,23172245,[],CHEMBL4814646,Antibacterial activity against Escherichia coli by microbroth dilution method,F,,,BAO_0002146,BAO_0000218,organism-based format,CCn1cc(C(=O)O)c(=O)c2cc(F)c(N3CCNCC3)cc21,,,CHEMBL4813920,Eur J Med Chem,2021.0,,CHEMBL9,NORFLOXACIN,CHEMBL9,,0,http://www.openphacts.org/units/Nanomolar,3602922,=,1,1,=,,MIC,nM,,1605000.0,CHEMBL354,Escherichia coli,Escherichia coli,562.0,,,MIC,mM,UO_0000065,,1.605
16558,,,23172247,[],CHEMBL4814647,Antibacterial activity against Enterococcus faecalis by microbroth dilution method,F,,,BAO_0002146,BAO_0000218,organism-based format,CCn1cc(C(=O)O)c(=O)c2cc(F)c(N3CCNCC3)cc21,,,CHEMBL4813920,Eur J Med Chem,2021.0,,CHEMBL9,NORFLOXACIN,CHEMBL9,,0,http://www.openphacts.org/units/Nanomolar,3602922,=,1,1,=,,MIC,nM,,803000.0,CHEMBL362,Enterococcus faecalis,Enterococcus faecalis,1351.0,,,MIC,mM,UO_0000065,,0.8029999999999999
16559,,,23172249,[],CHEMBL4814648,Antibacterial activity against Pseudomonas aeruginosa ATCC 27853 by microbroth dilution method,F,,,BAO_0002146,BAO_0000218,organism-based format,CCn1cc(C(=O)O)c(=O)c2cc(F)c(N3CCNCC3)cc21,,,CHEMBL4813920,Eur J Med Chem,2021.0,,CHEMBL9,NORFLOXACIN,CHEMBL9,,0,http://www.openphacts.org/units/Nanomolar,3602922,=,1,1,=,,MIC,nM,,1605000.0,CHEMBL348,Pseudomonas aeruginosa,Pseudomonas aeruginosa,287.0,,,MIC,mM,UO_0000065,,1.605
16560,,,23172251,[],CHEMBL4814649,Antibacterial activity against Acinetobacter baumannii by microbroth dilution method,F,,,BAO_0002146,BAO_0000218,organism-based format,CCn1cc(C(=O)O)c(=O)c2cc(F)c(N3CCNCC3)cc21,,,CHEMBL4813920,Eur J Med Chem,2021.0,,CHEMBL9,NORFLOXACIN,CHEMBL9,,0,http://www.openphacts.org/units/Nanomolar,3602922,=,1,1,=,,MIC,nM,,803000.0,CHEMBL614425,Acinetobacter baumannii,Acinetobacter baumannii,470.0,,,MIC,mM,UO_0000065,,0.8029999999999999
16561,,,23182519,[],CHEMBL4816900,Antibacterial activity against methicillin-resistant Staphylococcus aureus assessed as reduction in microbial growth by two fold microdilution method,F,,,BAO_0002146,BAO_0000218,organism-based format,CCn1cc(C(=O)O)c(=O)c2cc(F)c(N3CCNCC3)cc21,,,CHEMBL4813987,Eur J Med Chem,2021.0,,CHEMBL9,NORFLOXACIN,CHEMBL9,,0,http://www.openphacts.org/units/MicrogramPerMilliliter,3604680,=,1,1,=,,MIC,ug.mL-1,,16.0,CHEMBL352,Staphylococcus aureus,Staphylococcus aureus,1280.0,,,MIC,ug ml-1,UO_0000274,,16.0
16562,,,23182541,[],CHEMBL4816901,Antibacterial activity against Staphylococcus aureus assessed as reduction in microbial growth by two fold microdilution method,F,,,BAO_0002146,BAO_0000218,organism-based format,CCn1cc(C(=O)O)c(=O)c2cc(F)c(N3CCNCC3)cc21,,,CHEMBL4813987,Eur J Med Chem,2021.0,,CHEMBL9,NORFLOXACIN,CHEMBL9,,0,http://www.openphacts.org/units/MicrogramPerMilliliter,3604680,=,1,1,=,,MIC,ug.mL-1,,4.0,CHEMBL352,Staphylococcus aureus,Staphylococcus aureus,1280.0,,,MIC,ug ml-1,UO_0000274,,4.0
16563,,,23182563,[],CHEMBL4816902,Antibacterial activity against Staphylococcus aureus ATCC 25923 assessed as reduction in microbial growth by two fold microdilution method,F,,,BAO_0002146,BAO_0000218,organism-based format,CCn1cc(C(=O)O)c(=O)c2cc(F)c(N3CCNCC3)cc21,,,CHEMBL4813987,Eur J Med Chem,2021.0,,CHEMBL9,NORFLOXACIN,CHEMBL9,,0,http://www.openphacts.org/units/MicrogramPerMilliliter,3604680,=,1,1,=,,MIC,ug.mL-1,,2.0,CHEMBL352,Staphylococcus aureus,Staphylococcus aureus,1280.0,,,MIC,ug ml-1,UO_0000274,,2.0
16564,,,23182585,[],CHEMBL4816903,Antibacterial activity against Staphylococcus aureus ATCC 29213 assessed as reduction in microbial growth by two fold microdilution method,F,,,BAO_0002146,BAO_0000218,organism-based format,CCn1cc(C(=O)O)c(=O)c2cc(F)c(N3CCNCC3)cc21,,,CHEMBL4813987,Eur J Med Chem,2021.0,,CHEMBL9,NORFLOXACIN,CHEMBL9,,0,http://www.openphacts.org/units/MicrogramPerMilliliter,3604680,=,1,1,=,,MIC,ug.mL-1,,2.0,CHEMBL352,Staphylococcus aureus,Staphylococcus aureus,1280.0,,,MIC,ug ml-1,UO_0000274,,2.0
16565,,,23182607,[],CHEMBL4816904,Antibacterial activity against Enterococcus faecalis assessed as reduction in microbial growth by two fold microdilution method,F,,,BAO_0002146,BAO_0000218,organism-based format,CCn1cc(C(=O)O)c(=O)c2cc(F)c(N3CCNCC3)cc21,,,CHEMBL4813987,Eur J Med Chem,2021.0,,CHEMBL9,NORFLOXACIN,CHEMBL9,,0,http://www.openphacts.org/units/MicrogramPerMilliliter,3604680,=,1,1,=,,MIC,ug.mL-1,,4.0,CHEMBL362,Enterococcus faecalis,Enterococcus faecalis,1351.0,,,MIC,ug ml-1,UO_0000274,,4.0
16566,,,23182629,[],CHEMBL4816905,Antibacterial activity against Klebsiella pneumonia assessed as reduction in microbial growth by two fold microdilution method,F,,,BAO_0002146,BAO_0000218,organism-based format,CCn1cc(C(=O)O)c(=O)c2cc(F)c(N3CCNCC3)cc21,,,CHEMBL4813987,Eur J Med Chem,2021.0,,CHEMBL9,NORFLOXACIN,CHEMBL9,,0,http://www.openphacts.org/units/MicrogramPerMilliliter,3604680,=,1,1,=,,MIC,ug.mL-1,,4.0,CHEMBL350,Klebsiella pneumoniae,Klebsiella pneumoniae,573.0,,,MIC,ug ml-1,UO_0000274,,4.0
16567,,,23182651,[],CHEMBL4816906,Antibacterial activity against Acinetobacter baumannii assessed as reduction in microbial growth by two fold microdilution method,F,,,BAO_0002146,BAO_0000218,organism-based format,CCn1cc(C(=O)O)c(=O)c2cc(F)c(N3CCNCC3)cc21,,,CHEMBL4813987,Eur J Med Chem,2021.0,,CHEMBL9,NORFLOXACIN,CHEMBL9,,0,http://www.openphacts.org/units/MicrogramPerMilliliter,3604680,=,1,1,=,,MIC,ug.mL-1,,2.0,CHEMBL614425,Acinetobacter baumannii,Acinetobacter baumannii,470.0,,,MIC,ug ml-1,UO_0000274,,2.0
16568,,,23182673,[],CHEMBL4816907,Antibacterial activity against Escherichia coli assessed as reduction in microbial growth by two fold microdilution method,F,,,BAO_0002146,BAO_0000218,organism-based format,CCn1cc(C(=O)O)c(=O)c2cc(F)c(N3CCNCC3)cc21,,,CHEMBL4813987,Eur J Med Chem,2021.0,,CHEMBL9,NORFLOXACIN,CHEMBL9,,0,http://www.openphacts.org/units/MicrogramPerMilliliter,3604680,=,1,1,=,,MIC,ug.mL-1,,16.0,CHEMBL354,Escherichia coli,Escherichia coli,562.0,,,MIC,ug ml-1,UO_0000274,,16.0
16569,,,23182695,[],CHEMBL4816908,Antibacterial activity against Escherichia coli ATCC 25922 assessed as reduction in microbial growth by two fold microdilution method,F,,,BAO_0002146,BAO_0000218,organism-based format,CCn1cc(C(=O)O)c(=O)c2cc(F)c(N3CCNCC3)cc21,,,CHEMBL4813987,Eur J Med Chem,2021.0,,CHEMBL9,NORFLOXACIN,CHEMBL9,,0,http://www.openphacts.org/units/MicrogramPerMilliliter,3604680,=,1,1,=,,MIC,ug.mL-1,,16.0,CHEMBL354,Escherichia coli,Escherichia coli,562.0,,,MIC,ug ml-1,UO_0000274,,16.0
16570,,,23182717,[],CHEMBL4816909,Antibacterial activity against Pseudomonas aeruginosa assessed as reduction in microbial growth by two fold microdilution method,F,,,BAO_0002146,BAO_0000218,organism-based format,CCn1cc(C(=O)O)c(=O)c2cc(F)c(N3CCNCC3)cc21,,,CHEMBL4813987,Eur J Med Chem,2021.0,,CHEMBL9,NORFLOXACIN,CHEMBL9,,0,http://www.openphacts.org/units/MicrogramPerMilliliter,3604680,=,1,1,=,,MIC,ug.mL-1,,2.0,CHEMBL348,Pseudomonas aeruginosa,Pseudomonas aeruginosa,287.0,,,MIC,ug ml-1,UO_0000274,,2.0
16571,,,23182739,[],CHEMBL4816910,Antibacterial activity against Pseudomonas aeruginosa ATCC 27853 assessed as reduction in microbial growth by two fold microdilution method,F,,,BAO_0002146,BAO_0000218,organism-based format,CCn1cc(C(=O)O)c(=O)c2cc(F)c(N3CCNCC3)cc21,,,CHEMBL4813987,Eur J Med Chem,2021.0,,CHEMBL9,NORFLOXACIN,CHEMBL9,,0,http://www.openphacts.org/units/MicrogramPerMilliliter,3604680,=,1,1,=,,MIC,ug.mL-1,,8.0,CHEMBL348,Pseudomonas aeruginosa,Pseudomonas aeruginosa,287.0,,,MIC,ug ml-1,UO_0000274,,8.0
16572,,,23188179,[],CHEMBL4818005,Antibacterial activity against methicillin-resistant Staphylococcus aureus by broth microdilution assay,F,,,BAO_0002146,BAO_0000218,organism-based format,CCn1cc(C(=O)O)c(=O)c2cc(F)c(N3CCNCC3)cc21,,,CHEMBL4814033,Bioorg Med Chem Lett,2021.0,,CHEMBL9,NORFLOXACIN,CHEMBL9,,0,http://www.openphacts.org/units/MicrogramPerMilliliter,3605760,=,1,1,=,,MIC,ug.mL-1,,16.0,CHEMBL352,Staphylococcus aureus,Staphylococcus aureus,1280.0,,,MIC,ug ml-1,UO_0000274,,16.0
16573,,,23188196,[],CHEMBL4818006,Antibacterial activity against Enterococcus faecalis by broth microdilution assay,F,,,BAO_0002146,BAO_0000218,organism-based format,CCn1cc(C(=O)O)c(=O)c2cc(F)c(N3CCNCC3)cc21,,,CHEMBL4814033,Bioorg Med Chem Lett,2021.0,,CHEMBL9,NORFLOXACIN,CHEMBL9,,0,http://www.openphacts.org/units/MicrogramPerMilliliter,3605760,=,1,1,=,,MIC,ug.mL-1,,8.0,CHEMBL362,Enterococcus faecalis,Enterococcus faecalis,1351.0,,,MIC,ug ml-1,UO_0000274,,8.0
16574,,,23188213,[],CHEMBL4818007,Antibacterial activity against Staphylococcus aureus by broth microdilution assay,F,,,BAO_0002146,BAO_0000218,organism-based format,CCn1cc(C(=O)O)c(=O)c2cc(F)c(N3CCNCC3)cc21,,,CHEMBL4814033,Bioorg Med Chem Lett,2021.0,,CHEMBL9,NORFLOXACIN,CHEMBL9,,0,http://www.openphacts.org/units/MicrogramPerMilliliter,3605760,=,1,1,=,,MIC,ug.mL-1,,4.0,CHEMBL352,Staphylococcus aureus,Staphylococcus aureus,1280.0,,,MIC,ug ml-1,UO_0000274,,4.0
16575,,,23188230,[],CHEMBL4818008,Antibacterial activity against Staphylococcus aureus ATCC 25923 by broth microdilution assay,F,,,BAO_0002146,BAO_0000218,organism-based format,CCn1cc(C(=O)O)c(=O)c2cc(F)c(N3CCNCC3)cc21,,,CHEMBL4814033,Bioorg Med Chem Lett,2021.0,,CHEMBL9,NORFLOXACIN,CHEMBL9,,0,http://www.openphacts.org/units/MicrogramPerMilliliter,3605760,=,1,1,=,,MIC,ug.mL-1,,8.0,CHEMBL352,Staphylococcus aureus,Staphylococcus aureus,1280.0,,,MIC,ug ml-1,UO_0000274,,8.0
16576,,,23188247,[],CHEMBL4818009,Antibacterial activity against Staphylococcus aureus ATCC 29213 by broth microdilution assay,F,,,BAO_0002146,BAO_0000218,organism-based format,CCn1cc(C(=O)O)c(=O)c2cc(F)c(N3CCNCC3)cc21,,,CHEMBL4814033,Bioorg Med Chem Lett,2021.0,,CHEMBL9,NORFLOXACIN,CHEMBL9,,0,http://www.openphacts.org/units/MicrogramPerMilliliter,3605760,=,1,1,=,,MIC,ug.mL-1,,8.0,CHEMBL352,Staphylococcus aureus,Staphylococcus aureus,1280.0,,,MIC,ug ml-1,UO_0000274,,8.0
16577,,,23188264,[],CHEMBL4818010,Antibacterial activity against Klebsiella pneumonia by broth microdilution assay,F,,,BAO_0002146,BAO_0000218,organism-based format,CCn1cc(C(=O)O)c(=O)c2cc(F)c(N3CCNCC3)cc21,,,CHEMBL4814033,Bioorg Med Chem Lett,2021.0,,CHEMBL9,NORFLOXACIN,CHEMBL9,,0,http://www.openphacts.org/units/MicrogramPerMilliliter,3605760,=,1,1,=,,MIC,ug.mL-1,,16.0,CHEMBL350,Klebsiella pneumoniae,Klebsiella pneumoniae,573.0,,,MIC,ug ml-1,UO_0000274,,16.0
16578,,,23188281,[],CHEMBL4818011,Antibacterial activity against Escherichia coli by broth microdilution assay,F,,,BAO_0002146,BAO_0000218,organism-based format,CCn1cc(C(=O)O)c(=O)c2cc(F)c(N3CCNCC3)cc21,,,CHEMBL4814033,Bioorg Med Chem Lett,2021.0,,CHEMBL9,NORFLOXACIN,CHEMBL9,,0,http://www.openphacts.org/units/MicrogramPerMilliliter,3605760,=,1,1,=,,MIC,ug.mL-1,,8.0,CHEMBL354,Escherichia coli,Escherichia coli,562.0,,,MIC,ug ml-1,UO_0000274,,8.0
16579,,,23188298,[],CHEMBL4818012,Antibacterial activity against Escherichia coli ATCC 25922 by broth microdilution assay,F,,,BAO_0002146,BAO_0000218,organism-based format,CCn1cc(C(=O)O)c(=O)c2cc(F)c(N3CCNCC3)cc21,,,CHEMBL4814033,Bioorg Med Chem Lett,2021.0,,CHEMBL9,NORFLOXACIN,CHEMBL9,,0,http://www.openphacts.org/units/MicrogramPerMilliliter,3605760,=,1,1,=,,MIC,ug.mL-1,,8.0,CHEMBL354,Escherichia coli,Escherichia coli,562.0,,,MIC,ug ml-1,UO_0000274,,8.0
16580,,,23188315,[],CHEMBL4818013,Antibacterial activity against Pseudomonas aeruginosa by broth microdilution assay,F,,,BAO_0002146,BAO_0000218,organism-based format,CCn1cc(C(=O)O)c(=O)c2cc(F)c(N3CCNCC3)cc21,,,CHEMBL4814033,Bioorg Med Chem Lett,2021.0,,CHEMBL9,NORFLOXACIN,CHEMBL9,,0,http://www.openphacts.org/units/MicrogramPerMilliliter,3605760,=,1,1,=,,MIC,ug.mL-1,,4.0,CHEMBL348,Pseudomonas aeruginosa,Pseudomonas aeruginosa,287.0,,,MIC,ug ml-1,UO_0000274,,4.0
16581,,,23188332,[],CHEMBL4818014,Antibacterial activity against Pseudomonas aeruginosa ATCC 27853 by broth microdilution assay,F,,,BAO_0002146,BAO_0000218,organism-based format,CCn1cc(C(=O)O)c(=O)c2cc(F)c(N3CCNCC3)cc21,,,CHEMBL4814033,Bioorg Med Chem Lett,2021.0,,CHEMBL9,NORFLOXACIN,CHEMBL9,,0,http://www.openphacts.org/units/MicrogramPerMilliliter,3605760,=,1,1,=,,MIC,ug.mL-1,,8.0,CHEMBL348,Pseudomonas aeruginosa,Pseudomonas aeruginosa,287.0,,,MIC,ug ml-1,UO_0000274,,8.0
16582,,,23188349,[],CHEMBL4818015,Antibacterial activity against Acinetobacter baumannii by broth microdilution assay,F,,,BAO_0002146,BAO_0000218,organism-based format,CCn1cc(C(=O)O)c(=O)c2cc(F)c(N3CCNCC3)cc21,,,CHEMBL4814033,Bioorg Med Chem Lett,2021.0,,CHEMBL9,NORFLOXACIN,CHEMBL9,,0,http://www.openphacts.org/units/MicrogramPerMilliliter,3605760,=,1,1,=,,MIC,ug.mL-1,,8.0,CHEMBL614425,Acinetobacter baumannii,Acinetobacter baumannii,470.0,,,MIC,ug ml-1,UO_0000274,,8.0
16583,,Not Active,23188353,[],CHEMBL4818017,Antibacterial activity against methicillin-resistant Staphylococcus aureus assessed as reduction in bacterial growth measured after 16 passages,F,,,BAO_0000375,BAO_0000218,organism-based format,CCn1cc(C(=O)O)c(=O)c2cc(F)c(N3CCNCC3)cc21,,,CHEMBL4814033,Bioorg Med Chem Lett,2021.0,,CHEMBL9,NORFLOXACIN,CHEMBL9,,0,,3605760,,1,0,,,Activity,,,,CHEMBL352,Staphylococcus aureus,Staphylococcus aureus,1280.0,,,Activity,,,,
16584,,,23189663,[],CHEMBL4818352,Antibacterial activity against methicillin resistant Staphylococcus aureus by broth microdilution method,F,,,BAO_0002146,BAO_0000218,organism-based format,CCn1cc(C(=O)O)c(=O)c2cc(F)c(N3CCNCC3)cc21,,,CHEMBL4814052,Bioorg Med Chem Lett,2021.0,,CHEMBL9,NORFLOXACIN,CHEMBL9,,0,http://www.openphacts.org/units/MicrogramPerMilliliter,3606158,=,1,1,=,,MIC,ug.mL-1,,8.0,CHEMBL352,Staphylococcus aureus,Staphylococcus aureus,1280.0,,,MIC,ug ml-1,UO_0000274,,8.0
16585,,,23189684,[],CHEMBL4818353,Antibacterial activity against Enterococcus faecalis by broth microdilution method,F,,,BAO_0002146,BAO_0000218,organism-based format,CCn1cc(C(=O)O)c(=O)c2cc(F)c(N3CCNCC3)cc21,,,CHEMBL4814052,Bioorg Med Chem Lett,2021.0,,CHEMBL9,NORFLOXACIN,CHEMBL9,,0,http://www.openphacts.org/units/MicrogramPerMilliliter,3606158,=,1,1,=,,MIC,ug.mL-1,,4.0,CHEMBL362,Enterococcus faecalis,Enterococcus faecalis,1351.0,,,MIC,ug ml-1,UO_0000274,,4.0
