Unnamed: 0,action_type,activity_comment,activity_id,activity_properties,assay_chembl_id,assay_description,assay_type,assay_variant_accession,assay_variant_mutation,bao_endpoint,bao_format,bao_label,canonical_smiles,data_validity_comment,data_validity_description,document_chembl_id,document_journal,document_year,ligand_efficiency,molecule_chembl_id,molecule_pref_name,parent_molecule_chembl_id,pchembl_value,potential_duplicate,qudt_units,record_id,relation,src_id,standard_flag,standard_relation,standard_text_value,standard_type,standard_units,standard_upper_value,standard_value,target_chembl_id,target_organism,target_pref_name,target_tax_id,text_value,toid,type,units,uo_units,upper_value,value
101274,,,3106739,[],CHEMBL1073063,Inhibition of Pneumocystis carinii DHFR at 37 degC by spectrophotometry,B,,,BAO_0000190,BAO_0000357,single protein format,COc1cc(Cc2cnc(N)nc2N)cc(OC)c1OC,,,CHEMBL1159120,Bioorg Med Chem,2010.0,"{'bei': '16.95', 'le': '0.32', 'lle': '3.66', 'sei': '4.66'}",CHEMBL22,TRIMETHOPRIM,CHEMBL22,4.92,1,http://www.openphacts.org/units/Nanomolar,884532,=,1,1,=,,IC50,nM,,12000.0,CHEMBL1926,Pneumocystis carinii,Dihydrofolate reductase,4754.0,,,IC50,uM,UO_0000065,,12.0
101275,,,3107846,[],CHEMBL1073071,Selectivity ratio of IC50 for rat liver DHFR to IC50 for Mycobacterium avium DHFR,B,,,BAO_0000179,BAO_0000019,assay format,COc1cc(Cc2cnc(N)nc2N)cc(OC)c1OC,,,CHEMBL1159120,Bioorg Med Chem,2010.0,,CHEMBL22,TRIMETHOPRIM,CHEMBL22,,0,,884532,=,1,0,=,,Ratio IC50,,,610.0,CHEMBL612545,,Unchecked,,,,Ratio IC50,,,,610.0
101276,,Not Active,3207406,[],CHEMBL1117580,Inhibition of Escherichia coli HS294 ACCase,B,,,BAO_0000190,BAO_0000019,assay format,COc1cc(Cc2cnc(N)nc2N)cc(OC)c1OC,,,CHEMBL1153699,Bioorg Med Chem Lett,2009.0,,CHEMBL22,TRIMETHOPRIM,CHEMBL22,,0,,890966,,1,0,,,IC50,,,,CHEMBL612545,,Unchecked,,,,IC50,,,,
101277,,,3207407,[],CHEMBL1117581,Antimicrobial activity against Escherichia coli HS294,F,,,BAO_0002146,BAO_0000218,organism-based format,COc1cc(Cc2cnc(N)nc2N)cc(OC)c1OC,,,CHEMBL1153699,Bioorg Med Chem Lett,2009.0,,CHEMBL22,TRIMETHOPRIM,CHEMBL22,,0,http://www.openphacts.org/units/MicrogramPerMilliliter,890966,=,1,1,=,,MIC,ug.mL-1,,0.1,CHEMBL354,Escherichia coli,Escherichia coli,562.0,,,MIC,ug ml-1,UO_0000274,,0.1
101278,,,3207408,[],CHEMBL1117582,Selectivity ratio of MIC for Escherichia coli HS294 to IC50 for Escherichia coli HS294 ACCase,F,,,BAO_0002146,BAO_0000019,assay format,COc1cc(Cc2cnc(N)nc2N)cc(OC)c1OC,,,CHEMBL1153699,Bioorg Med Chem Lett,2009.0,,CHEMBL22,TRIMETHOPRIM,CHEMBL22,,0,http://www.openphacts.org/units/MicrogramPerMilliliter,890966,=,1,1,=,,MIC,ug.mL-1,,0.1,CHEMBL612545,,Unchecked,,,,MIC,ug ml-1,UO_0000274,,0.1
101279,,,3216116,[],CHEMBL1100460,"Dissociation constant, pKa of the compound",P,,,BAO_0002131,BAO_0000100,small-molecule physicochemical format,COc1cc(Cc2cnc(N)nc2N)cc(OC)c1OC,,,CHEMBL1153781,Eur J Med Chem,2009.0,,CHEMBL22,TRIMETHOPRIM,CHEMBL22,,0,,899192,=,1,0,=,,pKa,,,7.26,CHEMBL2362975,,No relevant target,,,,pKa,,,,7.26
101280,,,3216207,[],CHEMBL1100461,Fraction unbound in human plasma,A,,,BAO_0000179,BAO_0000366,cell-free format,COc1cc(Cc2cnc(N)nc2N)cc(OC)c1OC,,,CHEMBL1153781,Eur J Med Chem,2009.0,,CHEMBL22,TRIMETHOPRIM,CHEMBL22,,0,,899192,=,1,0,=,,logFu,,,0.63,CHEMBL613652,Rattus norvegicus,Plasma,10116.0,,,logFu,,,,0.63
101281,,,3217434,[],CHEMBL1100462,Volume of distribution at steady state in human,A,,,BAO_0003041,BAO_0000218,organism-based format,COc1cc(Cc2cnc(N)nc2N)cc(OC)c1OC,,,CHEMBL1153781,Eur J Med Chem,2009.0,,CHEMBL22,TRIMETHOPRIM,CHEMBL22,,0,,899192,=,1,1,=,,Vdss,L.kg-1,,1.6,CHEMBL372,Homo sapiens,Homo sapiens,9606.0,,,Vdss,L/Kg,UO_0000197,,1.6
101282,,,3242737,[],CHEMBL1115358,Inhibition of human DHFR,B,,,BAO_0000190,BAO_0000357,single protein format,COc1cc(Cc2cnc(N)nc2N)cc(OC)c1OC,Outside typical range,"Values for this activity type are unusually large/small, so may not be accurate",CHEMBL1156263,J Med Chem,2010.0,,CHEMBL22,TRIMETHOPRIM,CHEMBL22,,1,http://www.openphacts.org/units/Nanomolar,900412,=,1,1,=,,IC50,nM,,680000.0,CHEMBL202,Homo sapiens,Dihydrofolate reductase,9606.0,,,IC50,uM,UO_0000065,,680.0
101283,,,3242738,[],CHEMBL1115359,Inhibition of Escherichia coli DHFR,B,,,BAO_0000190,BAO_0000357,single protein format,COc1cc(Cc2cnc(N)nc2N)cc(OC)c1OC,,,CHEMBL1156263,J Med Chem,2010.0,"{'bei': '26.52', 'le': '0.50', 'lle': '6.44', 'sei': '7.30'}",CHEMBL22,TRIMETHOPRIM,CHEMBL22,7.7,1,http://www.openphacts.org/units/Nanomolar,900412,=,1,1,=,,IC50,nM,,20.0,CHEMBL1809,Escherichia coli,Dihydrofolate reductase,562.0,,,IC50,uM,UO_0000065,,0.02
101284,,,3242739,[],CHEMBL1113610,Inhibition of Toxoplasma gondii DHFR,B,,,BAO_0000190,BAO_0000019,assay format,COc1cc(Cc2cnc(N)nc2N)cc(OC)c1OC,,,CHEMBL1156263,J Med Chem,2010.0,,CHEMBL22,TRIMETHOPRIM,CHEMBL22,5.54,0,http://www.openphacts.org/units/Nanomolar,900412,=,1,1,=,,IC50,nM,,2900.0,CHEMBL612545,,Unchecked,,,,IC50,uM,UO_0000065,,2.9
101285,,,3265146,[],CHEMBL1116254,Human intestinal absorption in po dosed human,A,,,BAO_0001103,BAO_0000218,organism-based format,COc1cc(Cc2cnc(N)nc2N)cc(OC)c1OC,,,CHEMBL1157012,Eur J Med Chem,2010.0,,CHEMBL22,TRIMETHOPRIM,CHEMBL22,,0,http://qudt.org/vocab/unit#Percent,906001,=,1,0,=,,Activity,%,,0.97,CHEMBL372,Homo sapiens,Homo sapiens,9606.0,,,Activity,%,UO_0000187,,0.97
101286,,,3269349,[],CHEMBL1111862,Antibacterial activity against MBX-1090-resistant Staphylococcus aureus isolate d20A1 after 16 to 20 hrs by broth microdilution method,F,,,BAO_0002146,BAO_0000218,organism-based format,COc1cc(Cc2cnc(N)nc2N)cc(OC)c1OC,,,CHEMBL1157072,Bioorg Med Chem,2010.0,,CHEMBL22,TRIMETHOPRIM,CHEMBL22,,0,http://www.openphacts.org/units/MicrogramPerMilliliter,906623,=,1,1,=,,MIC,ug.mL-1,,3.125,CHEMBL352,Staphylococcus aureus,Staphylococcus aureus,1280.0,,,MIC,ug ml-1,UO_0000274,,3.125
101287,,,3269380,[],CHEMBL1111860,Antibacterial activity against Staphylococcus aureus NCTC 8325 after 16 to 20 hrs by broth microdilution method,F,,,BAO_0002146,BAO_0000218,organism-based format,COc1cc(Cc2cnc(N)nc2N)cc(OC)c1OC,,,CHEMBL1157072,Bioorg Med Chem,2010.0,,CHEMBL22,TRIMETHOPRIM,CHEMBL22,,0,http://www.openphacts.org/units/MicrogramPerMilliliter,906623,=,1,1,=,,MIC,ug.mL-1,,3.125,CHEMBL352,Staphylococcus aureus,Staphylococcus aureus,1280.0,,,MIC,ug ml-1,UO_0000274,,3.125
101288,,,3280984,[],CHEMBL1112926,"Therapeutic index, ratio of TD50 for HFF cells to IC50 for Toxoplasma gondii F2",A,,,BAO_0000179,BAO_0000219,cell-based format,COc1cc(Cc2cnc(N)nc2N)cc(OC)c1OC,,,CHEMBL1158535,J Med Chem,2010.0,,CHEMBL22,TRIMETHOPRIM,CHEMBL22,,0,,909399,=,1,0,=,,TI,,,12.0,CHEMBL612558,,ADMET,,,,TI,,,,12.0
101289,,,3282050,[],CHEMBL1112924,Antiparasitic activity against Toxoplasma gondii 2F infected in HFF cells assessed as beta galactosidase activity after 5 days,F,,,BAO_0000190,BAO_0000218,organism-based format,COc1cc(Cc2cnc(N)nc2N)cc(OC)c1OC,,,CHEMBL1158535,J Med Chem,2010.0,,CHEMBL22,TRIMETHOPRIM,CHEMBL22,4.34,0,http://www.openphacts.org/units/Nanomolar,909399,=,1,1,=,,IC50,nM,,46000.0,CHEMBL612888,Toxoplasma gondii,Toxoplasma gondii,5811.0,,,IC50,uM,UO_0000065,,46.0
101290,,,3282060,[],CHEMBL1112925,Cytotoxicity against HFF after 5 days by Cell titer glo assay,A,,,BAO_0000179,BAO_0000219,cell-based format,COc1cc(Cc2cnc(N)nc2N)cc(OC)c1OC,,,CHEMBL1158535,J Med Chem,2010.0,,CHEMBL22,TRIMETHOPRIM,CHEMBL22,,0,http://www.openphacts.org/units/Micromolar,909399,>=,1,0,>=,,TD50,uM,,320.0,CHEMBL614071,Homo sapiens,HFF,9606.0,,,TD50,uM,UO_0000064,,320.0
101291,,,3282165,[],CHEMBL1112933,Transcellular permeability at pH 6.5 calculated from in vitro P app values in Caco-2 and/or MDCK cells,A,,,BAO_0000179,BAO_0000219,cell-based format,COc1cc(Cc2cnc(N)nc2N)cc(OC)c1OC,,,CHEMBL1158536,J Med Chem,2010.0,,CHEMBL22,TRIMETHOPRIM,CHEMBL22,,0,,910212,=,1,0,=,,logPapp,,,-4.56,CHEMBL614068,Canis lupus familiaris,MDCK,9615.0,,,logPapp,,,,-4.56
101292,,,3282229,[],CHEMBL1112930,Absolute bioavailability in human,A,,,BAO_0003042,BAO_0000218,organism-based format,COc1cc(Cc2cnc(N)nc2N)cc(OC)c1OC,,,CHEMBL1158536,J Med Chem,2010.0,,CHEMBL22,TRIMETHOPRIM,CHEMBL22,,0,http://qudt.org/vocab/unit#Percent,910212,=,1,1,=,,F,%,,98.0,CHEMBL372,Homo sapiens,Homo sapiens,9606.0,,,F,%,UO_0000187,,98.0
101293,,,3296041,[],CHEMBL1108191,Selectivity ratio of IC50 for rat liver DHFR to IC50 for Mycobacterium avium DHFR,B,,,BAO_0000179,BAO_0000019,assay format,COc1cc(Cc2cnc(N)nc2N)cc(OC)c1OC,,,CHEMBL1157930,Bioorg Med Chem,2010.0,,CHEMBL22,TRIMETHOPRIM,CHEMBL22,,0,,910271,=,1,0,=,,Ratio IC50,,,600.0,CHEMBL612545,,Unchecked,,,,Ratio IC50,,,,600.0
101294,,,3296058,[],CHEMBL1108190,Selectivity ratio of IC50 for rat liver DHFR to IC50 for Toxoplasma gondii DHFR,B,,,BAO_0000179,BAO_0000019,assay format,COc1cc(Cc2cnc(N)nc2N)cc(OC)c1OC,,,CHEMBL1157930,Bioorg Med Chem,2010.0,,CHEMBL22,TRIMETHOPRIM,CHEMBL22,,0,,910271,=,1,0,=,,Ratio IC50,,,65.0,CHEMBL612545,,Unchecked,,,,Ratio IC50,,,,65.0
101295,,,3296075,[],CHEMBL1108187,Selectivity ratio of IC50 for rat liver DHFR to IC50 for Pneumocystis carinii DHFR,B,,,BAO_0000181,BAO_0000019,assay format,COc1cc(Cc2cnc(N)nc2N)cc(OC)c1OC,,,CHEMBL1157930,Bioorg Med Chem,2010.0,,CHEMBL22,TRIMETHOPRIM,CHEMBL22,,0,http://www.openphacts.org/units/Micromolar,910271,=,1,0,=,,Activity,uM,,14.0,CHEMBL612545,,Unchecked,,,,Activity,uM,UO_0000064,,14.0
101296,,,3296091,[],CHEMBL1108188,Inhibition of rat liver DHFR by continuous spectrophotometric assay,B,,,BAO_0000181,BAO_0000019,assay format,COc1cc(Cc2cnc(N)nc2N)cc(OC)c1OC,,,CHEMBL1157930,Bioorg Med Chem,2010.0,,CHEMBL22,TRIMETHOPRIM,CHEMBL22,,0,http://www.openphacts.org/units/Micromolar,910271,=,1,0,=,,Activity,uM,,180.0,CHEMBL2363,Rattus norvegicus,Dihydrofolate reductase,10116.0,,,Activity,uM,UO_0000064,,180.0
101297,,,3296108,[],CHEMBL1108185,Inhibition of Mycobacterium avium DHFR by continuous spectrophotometric assay,B,,,BAO_0000181,BAO_0000357,single protein format,COc1cc(Cc2cnc(N)nc2N)cc(OC)c1OC,,,CHEMBL1157930,Bioorg Med Chem,2010.0,,CHEMBL22,TRIMETHOPRIM,CHEMBL22,,0,http://www.openphacts.org/units/Micromolar,910271,=,1,0,=,,Activity,uM,,0.3,CHEMBL5457,Mycobacterium avium,Dihydrofolate reductase,1764.0,,,Activity,uM,UO_0000064,,0.3
101298,,,3296125,[],CHEMBL1108182,Inhibition of Toxoplasma gondii DHFR by continuous spectrophotometric assay,B,,,BAO_0000181,BAO_0000357,single protein format,COc1cc(Cc2cnc(N)nc2N)cc(OC)c1OC,,,CHEMBL1157930,Bioorg Med Chem,2010.0,,CHEMBL22,TRIMETHOPRIM,CHEMBL22,,0,http://www.openphacts.org/units/Micromolar,910271,=,1,0,=,,Activity,uM,,2.8,CHEMBL2425,Toxoplasma gondii,Dihydrofolate reductase,5811.0,,,Activity,uM,UO_0000064,,2.8
101299,,,3296143,[],CHEMBL1108181,Inhibition of Pneumocystis carinii DHFR by continuous spectrophotometric assay,B,,,BAO_0000181,BAO_0000357,single protein format,COc1cc(Cc2cnc(N)nc2N)cc(OC)c1OC,,,CHEMBL1157930,Bioorg Med Chem,2010.0,,CHEMBL22,TRIMETHOPRIM,CHEMBL22,,0,http://www.openphacts.org/units/Micromolar,910271,=,1,0,=,,Activity,uM,,13.0,CHEMBL1926,Pneumocystis carinii,Dihydrofolate reductase,4754.0,,,Activity,uM,UO_0000064,,13.0
101300,,Not Active,3386701,[],CHEMBL1217783,Antimicrobial activity against Pseudomonas luteola by disk diffusion method,F,,,BAO_0000375,BAO_0000019,assay format,COc1cc(Cc2cnc(N)nc2N)cc(OC)c1OC,,,CHEMBL1212770,Antimicrob Agents Chemother,2010.0,,CHEMBL22,TRIMETHOPRIM,CHEMBL22,,0,,930573,,1,0,,,Activity,,,,CHEMBL3879801,,NON-PROTEIN TARGET,,,,Activity,,,,
101301,,,3387381,[],CHEMBL1218002,Antimicrobial activity against Escherichia coli J5 transconjugants expressing beta lactamase CTX-M-9 isolated from human flora associated C3H rat infected with Salmonella enterica serotype Virchow and treated with Cefixime by Etest method,F,,,BAO_0002146,BAO_0000218,organism-based format,COc1cc(Cc2cnc(N)nc2N)cc(OC)c1OC,,,CHEMBL1212773,Antimicrob Agents Chemother,2010.0,,CHEMBL22,TRIMETHOPRIM,CHEMBL22,,0,http://www.openphacts.org/units/MicrogramPerMilliliter,929825,=,1,1,=,,MIC,ug.mL-1,,0.5,CHEMBL354,Escherichia coli,Escherichia coli,562.0,,,MIC,ug ml-1,UO_0000274,,0.5
101302,,,3387394,[],CHEMBL1218001,Antimicrobial activity against Escherichia coli J5 transconjugants expressing beta lactamase CTX-M-9 isolated from human flora associated C3H rat infected with Salmonella enterica serotype Virchow by Etest method,F,,,BAO_0002146,BAO_0000218,organism-based format,COc1cc(Cc2cnc(N)nc2N)cc(OC)c1OC,,,CHEMBL1212773,Antimicrob Agents Chemother,2010.0,,CHEMBL22,TRIMETHOPRIM,CHEMBL22,,0,http://www.openphacts.org/units/MicrogramPerMilliliter,929825,=,1,1,=,,MIC,ug.mL-1,,0.5,CHEMBL354,Escherichia coli,Escherichia coli,562.0,,,MIC,ug ml-1,UO_0000274,,0.5
101303,,,3387407,[],CHEMBL1218000,Antimicrobial activity against Escherichia coli J5 by Etest method,F,,,BAO_0002146,BAO_0000218,organism-based format,COc1cc(Cc2cnc(N)nc2N)cc(OC)c1OC,,,CHEMBL1212773,Antimicrob Agents Chemother,2010.0,,CHEMBL22,TRIMETHOPRIM,CHEMBL22,,0,http://www.openphacts.org/units/MicrogramPerMilliliter,929825,=,1,1,=,,MIC,ug.mL-1,,0.5,CHEMBL354,Escherichia coli,Escherichia coli,562.0,,,MIC,ug ml-1,UO_0000274,,0.5
101304,,,3387420,[],CHEMBL1217999,Antimicrobial activity against Salmonella enterica serotype Virchow 3464b by Etest method,F,,,BAO_0002146,BAO_0000218,organism-based format,COc1cc(Cc2cnc(N)nc2N)cc(OC)c1OC,,,CHEMBL1212773,Antimicrob Agents Chemother,2010.0,,CHEMBL22,TRIMETHOPRIM,CHEMBL22,,0,http://www.openphacts.org/units/MicrogramPerMilliliter,929825,>,1,1,>,,MIC,ug.mL-1,,64.0,CHEMBL613762,Salmonella enterica,Salmonella enterica,28901.0,,,MIC,ug ml-1,UO_0000274,,64.0
101305,,,3387433,[],CHEMBL1217998,Antimicrobial activity against Escherichia coli ATCC 25922 by Etest method,F,,,BAO_0002146,BAO_0000218,organism-based format,COc1cc(Cc2cnc(N)nc2N)cc(OC)c1OC,,,CHEMBL1212773,Antimicrob Agents Chemother,2010.0,,CHEMBL22,TRIMETHOPRIM,CHEMBL22,,0,http://www.openphacts.org/units/MicrogramPerMilliliter,929825,=,1,1,=,,MIC,ug.mL-1,,0.5,CHEMBL354,Escherichia coli,Escherichia coli,562.0,,,MIC,ug ml-1,UO_0000274,,0.5
101306,,,3387455,[],CHEMBL1218003,Antimicrobial activity against Escherichia coli J5 transconjugants expressing beta lactamase CTX-M-9 isolated from human flora associated C3H rat infected with Salmonella enterica serotype Virchow and treated with Cefixime-cluvulanic acid by Etest method,F,,,BAO_0002146,BAO_0000218,organism-based format,COc1cc(Cc2cnc(N)nc2N)cc(OC)c1OC,,,CHEMBL1212773,Antimicrob Agents Chemother,2010.0,,CHEMBL22,TRIMETHOPRIM,CHEMBL22,,0,http://www.openphacts.org/units/MicrogramPerMilliliter,929825,=,1,1,=,,MIC,ug.mL-1,,1.0,CHEMBL354,Escherichia coli,Escherichia coli,562.0,,,MIC,ug ml-1,UO_0000274,,1.0
101307,,,3389169,[],CHEMBL1216577,Antibacterial activity against azide-resistant Escherichia coli J53 SXT1 transconjugant with qnrVC3 gene expressing Vibrio cholerae 59 strain,F,,,BAO_0002146,BAO_0000218,organism-based format,COc1cc(Cc2cnc(N)nc2N)cc(OC)c1OC,,,CHEMBL1212795,Antimicrob Agents Chemother,2010.0,,CHEMBL22,TRIMETHOPRIM,CHEMBL22,,0,http://www.openphacts.org/units/MicrogramPerMilliliter,930161,>,1,1,>,,MIC,ug.mL-1,,32.0,CHEMBL354,Escherichia coli,Escherichia coli,562.0,,,MIC,ug ml-1,UO_0000274,,32.0
101308,,,3389177,[],CHEMBL1216578,Antibacterial activity against azide-resistant Escherichia coli J53 SXT2 transconjugant with qnrVC3 gene expressing Vibrio cholerae 59 strain,F,,,BAO_0002146,BAO_0000218,organism-based format,COc1cc(Cc2cnc(N)nc2N)cc(OC)c1OC,,,CHEMBL1212795,Antimicrob Agents Chemother,2010.0,,CHEMBL22,TRIMETHOPRIM,CHEMBL22,,0,http://www.openphacts.org/units/MicrogramPerMilliliter,930161,>,1,1,>,,MIC,ug.mL-1,,32.0,CHEMBL354,Escherichia coli,Escherichia coli,562.0,,,MIC,ug ml-1,UO_0000274,,32.0
101309,,,3389185,[],CHEMBL1216579,Antibacterial activity against azide-resistant Escherichia coli J53 TET1 transconjugant with qnrVC3 gene expressing Vibrio cholerae 59 strain,F,,,BAO_0002146,BAO_0000218,organism-based format,COc1cc(Cc2cnc(N)nc2N)cc(OC)c1OC,,,CHEMBL1212795,Antimicrob Agents Chemother,2010.0,,CHEMBL22,TRIMETHOPRIM,CHEMBL22,,0,http://www.openphacts.org/units/MicrogramPerMilliliter,930161,>,1,1,>,,MIC,ug.mL-1,,32.0,CHEMBL354,Escherichia coli,Escherichia coli,562.0,,,MIC,ug ml-1,UO_0000274,,32.0
101310,,,3389193,[],CHEMBL1216580,Antibacterial activity against azide-resistant Escherichia coli J53 TET2 transconjugant with qnrVC3 gene expressing Vibrio cholerae 59 strain,F,,,BAO_0002146,BAO_0000218,organism-based format,COc1cc(Cc2cnc(N)nc2N)cc(OC)c1OC,,,CHEMBL1212795,Antimicrob Agents Chemother,2010.0,,CHEMBL22,TRIMETHOPRIM,CHEMBL22,,0,http://www.openphacts.org/units/MicrogramPerMilliliter,930161,>,1,1,>,,MIC,ug.mL-1,,32.0,CHEMBL354,Escherichia coli,Escherichia coli,562.0,,,MIC,ug ml-1,UO_0000274,,32.0
101311,,,3390228,[],CHEMBL1217012,Antimicrobial activity against Cryptosporidium parvum,F,,,BAO_0000190,BAO_0000218,organism-based format,COc1cc(Cc2cnc(N)nc2N)cc(OC)c1OC,,,CHEMBL1212812,Bioorg Med Chem,2010.0,,CHEMBL22,TRIMETHOPRIM,CHEMBL22,5.4,0,http://www.openphacts.org/units/Nanomolar,929518,=,1,1,=,,IC50,nM,,4000.0,CHEMBL612855,Cryptosporidium parvum,Cryptosporidium parvum,5807.0,,,IC50,uM,UO_0000065,,4.0
101312,,,3394050,[],CHEMBL1217186,Antimicrobial activity against Pneumocystis carinii,F,,,BAO_0000190,BAO_0000218,organism-based format,COc1cc(Cc2cnc(N)nc2N)cc(OC)c1OC,Outside typical range,"Values for this activity type are unusually large/small, so may not be accurate",CHEMBL1212812,Bioorg Med Chem,2010.0,,CHEMBL22,TRIMETHOPRIM,CHEMBL22,,0,http://www.openphacts.org/units/Nanomolar,929518,=,1,1,=,,IC50,nM,,0.0,CHEMBL613064,Pneumocystis carinii,Pneumocystis carinii,4754.0,,,IC50,uM,UO_0000065,,0.0
101313,,,3394070,[],CHEMBL1217005,Antimicrobial activity against Toxoplasma gondii,F,,,BAO_0000190,BAO_0000218,organism-based format,COc1cc(Cc2cnc(N)nc2N)cc(OC)c1OC,Outside typical range,"Values for this activity type are unusually large/small, so may not be accurate",CHEMBL1212812,Bioorg Med Chem,2010.0,,CHEMBL22,TRIMETHOPRIM,CHEMBL22,,0,http://www.openphacts.org/units/Nanomolar,929518,=,1,1,=,,IC50,nM,,0.0,CHEMBL612888,Toxoplasma gondii,Toxoplasma gondii,5811.0,,,IC50,uM,UO_0000065,,0.0
101314,,Active,3397185,[],CHEMBL1220487,Inhibition of IPTG-stimulated Escherichia coli K-12 folA at 16 fold MIC by microarray analysis,B,,,BAO_0000201,BAO_0000357,single protein format,COc1cc(Cc2cnc(N)nc2N)cc(OC)c1OC,,,CHEMBL1212733,Nat Chem Biol,2009.0,,CHEMBL22,TRIMETHOPRIM,CHEMBL22,,0,http://qudt.org/vocab/unit#Percent,930025,,1,0,,,Inhibition,%,,,CHEMBL1809,Escherichia coli,Dihydrofolate reductase,562.0,,,INH,,UO_0000187,,
101315,,Active,3397197,[],CHEMBL1220497,Inhibition of IPTG-stimulated Escherichia coli K-12 folA at 8 fold MIC by microarray analysis,B,,,BAO_0000201,BAO_0000357,single protein format,COc1cc(Cc2cnc(N)nc2N)cc(OC)c1OC,,,CHEMBL1212733,Nat Chem Biol,2009.0,,CHEMBL22,TRIMETHOPRIM,CHEMBL22,,0,http://qudt.org/vocab/unit#Percent,930025,,1,0,,,Inhibition,%,,,CHEMBL1809,Escherichia coli,Dihydrofolate reductase,562.0,,,INH,,UO_0000187,,
101316,,Active,3397240,[],CHEMBL1218511,Inhibition of IPTG-stimulated Escherichia coli K-12 folA at 4 fold MIC by microarray analysis,B,,,BAO_0000201,BAO_0000357,single protein format,COc1cc(Cc2cnc(N)nc2N)cc(OC)c1OC,,,CHEMBL1212733,Nat Chem Biol,2009.0,,CHEMBL22,TRIMETHOPRIM,CHEMBL22,,0,http://qudt.org/vocab/unit#Percent,930025,,1,0,,,Inhibition,%,,,CHEMBL1809,Escherichia coli,Dihydrofolate reductase,562.0,,,INH,,UO_0000187,,
101317,,Active,3397241,[],CHEMBL1218512,Inhibition of IPTG-stimulated Escherichia coli K-12 rpSR at 4 fold MIC by microarray analysis,B,,,BAO_0000201,BAO_0000357,single protein format,COc1cc(Cc2cnc(N)nc2N)cc(OC)c1OC,,,CHEMBL1212733,Nat Chem Biol,2009.0,,CHEMBL22,TRIMETHOPRIM,CHEMBL22,,0,http://qudt.org/vocab/unit#Percent,930025,,1,0,,,Inhibition,%,,,CHEMBL2363090,Escherichia coli (strain K12),30S ribosomal protein S18,83333.0,,,INH,,UO_0000187,,
101318,,Active,3420604,[],CHEMBL1227289,Inhibition of DHFR in Escherichia coli K-12 NCM3722 assessed as impaired folylpoly-gamma-glutamate synthetase activity after 15 mins by [15N] flux profiling based LC-MS/MS method,B,,,BAO_0000201,BAO_0000357,single protein format,COc1cc(Cc2cnc(N)nc2N)cc(OC)c1OC,,,CHEMBL1221215,Nat Chem Biol,2008.0,,CHEMBL22,TRIMETHOPRIM,CHEMBL22,,0,http://qudt.org/vocab/unit#Percent,934635,,1,0,,,Inhibition,%,,,CHEMBL1809,Escherichia coli,Dihydrofolate reductase,562.0,,,INH,,UO_0000187,,
101319,,Active,3420605,[],CHEMBL1227288,Inhibition of DHFR in Escherichia coli K-12 NCM3722 assessed as increase in reduced mono and glutamate folate species level at 4 ug/ml after 20 mins by LC-MS/MS method,B,,,BAO_0000201,BAO_0000357,single protein format,COc1cc(Cc2cnc(N)nc2N)cc(OC)c1OC,,,CHEMBL1221215,Nat Chem Biol,2008.0,,CHEMBL22,TRIMETHOPRIM,CHEMBL22,,0,http://qudt.org/vocab/unit#Percent,934635,,1,0,,,Inhibition,%,,,CHEMBL1809,Escherichia coli,Dihydrofolate reductase,562.0,,,INH,,UO_0000187,,
101320,,Active,3420606,[],CHEMBL1227287,Inhibition of DHFR in Escherichia coli K-12 NCM3722 growing on filters on top of agarose medium support assessed as decrease in reduced folates level at 4 ug/ml by LC-MS/MS method,B,,,BAO_0000201,BAO_0000357,single protein format,COc1cc(Cc2cnc(N)nc2N)cc(OC)c1OC,,,CHEMBL1221215,Nat Chem Biol,2008.0,,CHEMBL22,TRIMETHOPRIM,CHEMBL22,,0,http://qudt.org/vocab/unit#Percent,934635,,1,0,,,Inhibition,%,,,CHEMBL1809,Escherichia coli,Dihydrofolate reductase,562.0,,,INH,,UO_0000187,,
101321,,Active,3420607,[],CHEMBL1227286,Inhibition of DHFR in Escherichia coli K-12 NCM3722 growing on filters on top of agarose medium support assessed as increase in oxidized folates level at 4 ug/ml by LC-MS/MS method,B,,,BAO_0000201,BAO_0000357,single protein format,COc1cc(Cc2cnc(N)nc2N)cc(OC)c1OC,,,CHEMBL1221215,Nat Chem Biol,2008.0,,CHEMBL22,TRIMETHOPRIM,CHEMBL22,,0,http://qudt.org/vocab/unit#Percent,934635,,1,0,,,Inhibition,%,,,CHEMBL1809,Escherichia coli,Dihydrofolate reductase,562.0,,,INH,,UO_0000187,,
101322,,Active,3420608,[],CHEMBL1227284,Inhibition of DHFR in Escherichia coli K-12 NCM3722 assessed as increase in oxidized folates level at 4 ug/ml by LC-MS/MS method,B,,,BAO_0000201,BAO_0000357,single protein format,COc1cc(Cc2cnc(N)nc2N)cc(OC)c1OC,,,CHEMBL1221215,Nat Chem Biol,2008.0,,CHEMBL22,TRIMETHOPRIM,CHEMBL22,,0,http://qudt.org/vocab/unit#Percent,934635,,1,0,,,Inhibition,%,,,CHEMBL1809,Escherichia coli,Dihydrofolate reductase,562.0,,,INH,,UO_0000187,,
101323,,Active,3420609,[],CHEMBL1227285,Inhibition of DHFR in Escherichia coli K-12 NCM3722 assessed as decrease in reduced folates level at 4 ug/ml by LC-MS/MS method,B,,,BAO_0000201,BAO_0000357,single protein format,COc1cc(Cc2cnc(N)nc2N)cc(OC)c1OC,,,CHEMBL1221215,Nat Chem Biol,2008.0,,CHEMBL22,TRIMETHOPRIM,CHEMBL22,,0,http://qudt.org/vocab/unit#Percent,934635,,1,0,,,Inhibition,%,,,CHEMBL1809,Escherichia coli,Dihydrofolate reductase,562.0,,,INH,,UO_0000187,,
101324,,Not Active,3420612,[],CHEMBL1227290,Inhibition of Escherichia coli K-12 recombinant His-tagged folylpoly-gamma-glutamate synthetase expressed in Escherichia coli BL21 at 200 uM LC-MS/MS method,B,,,BAO_0000201,BAO_0000019,assay format,COc1cc(Cc2cnc(N)nc2N)cc(OC)c1OC,,,CHEMBL1221215,Nat Chem Biol,2008.0,,CHEMBL22,TRIMETHOPRIM,CHEMBL22,,0,http://qudt.org/vocab/unit#Percent,934635,,1,0,,,Inhibition,%,,,CHEMBL3309008,Escherichia coli (strain K12),Bifunctional protein FolC,83333.0,,,INH,,UO_0000187,,
101325,,,3453723,[],CHEMBL1246593,"Antimicrobial activity against Staphylococcus aureus 25 transformant carrying plasmid pKKS25 and expressing erm(T), dfrKtet(L), tet(K), tet(M), mecA and blaZ genes by broth microdilution method",F,,,BAO_0002146,BAO_0000218,organism-based format,COc1cc(Cc2cnc(N)nc2N)cc(OC)c1OC,,,CHEMBL1240375,Antimicrob Agents Chemother,2010.0,,CHEMBL22,TRIMETHOPRIM,CHEMBL22,,0,http://www.openphacts.org/units/MicrogramPerMilliliter,953978,>=,1,1,>=,,MIC,ug.mL-1,,128.0,CHEMBL352,Staphylococcus aureus,Staphylococcus aureus,1280.0,,,MIC,ug ml-1,UO_0000274,,128.0
101326,,,3453740,[],CHEMBL1246592,"Antimicrobial activity against Staphylococcus aureus RN4220 transformant carrying plasmid pKKS25 and expressing erm(T), dfrK and tet(L) genes by broth microdilution method",F,,,BAO_0002146,BAO_0000218,organism-based format,COc1cc(Cc2cnc(N)nc2N)cc(OC)c1OC,,,CHEMBL1240375,Antimicrob Agents Chemother,2010.0,,CHEMBL22,TRIMETHOPRIM,CHEMBL22,,0,http://www.openphacts.org/units/MicrogramPerMilliliter,953978,>=,1,1,>=,,MIC,ug.mL-1,,128.0,CHEMBL352,Staphylococcus aureus,Staphylococcus aureus,1280.0,,,MIC,ug ml-1,UO_0000274,,128.0
101327,,,3453758,[],CHEMBL1246591,Antimicrobial activity against Staphylococcus aureus RN4220 by broth microdilution method,F,,,BAO_0002146,BAO_0000218,organism-based format,COc1cc(Cc2cnc(N)nc2N)cc(OC)c1OC,,,CHEMBL1240375,Antimicrob Agents Chemother,2010.0,,CHEMBL22,TRIMETHOPRIM,CHEMBL22,,0,http://www.openphacts.org/units/MicrogramPerMilliliter,953978,=,1,1,=,,MIC,ug.mL-1,,0.5,CHEMBL352,Staphylococcus aureus,Staphylococcus aureus,1280.0,,,MIC,ug ml-1,UO_0000274,,0.5
101328,,,3475638,[],CHEMBL1262632,Antibacterial activity against Escherichia coli DH5alpha with deltaampC by agar dilution method,F,,,BAO_0002146,BAO_0000218,organism-based format,COc1cc(Cc2cnc(N)nc2N)cc(OC)c1OC,,,CHEMBL1255335,Antimicrob Agents Chemother,2008.0,,CHEMBL22,TRIMETHOPRIM,CHEMBL22,,0,http://www.openphacts.org/units/MicrogramPerMilliliter,961605,<=,1,1,<=,,MIC,ug.mL-1,,0.125,CHEMBL354,Escherichia coli,Escherichia coli,562.0,,,MIC,ug ml-1,UO_0000274,,0.125
101329,,,3475659,[],CHEMBL1262635,Antibacterial activity against Escherichia coli DH5alpha expressing Klebsiella pneumoniae beta-lactamase SHV-1 by agar dilution method,F,,,BAO_0002146,BAO_0000218,organism-based format,COc1cc(Cc2cnc(N)nc2N)cc(OC)c1OC,,,CHEMBL1255335,Antimicrob Agents Chemother,2008.0,,CHEMBL22,TRIMETHOPRIM,CHEMBL22,,0,http://www.openphacts.org/units/MicrogramPerMilliliter,961605,<=,1,1,<=,,MIC,ug.mL-1,,0.125,CHEMBL354,Escherichia coli,Escherichia coli,562.0,,,MIC,ug ml-1,UO_0000274,,0.125
